{
  "$schema": "https://json-schema.org/draft/2020-12/schema",
  "$id": "urn:srcos:agent-machine:schema:capability-declaration:v0.1.0",
  "title": "CapabilityDeclaration",
  "description": "Secret-free declaration of one MCP-exposed capability with typed side effect, schemas, constraints, data classes, and policy hooks.",
  "type": "object",
  "additionalProperties": false,
  "required": ["specVersion", "id", "kind", "server", "tool", "effect", "dangerClass", "schemaRefs", "constraints", "dataClasses", "policy", "receiptSafety", "issuedAt"],
  "properties": {
    "specVersion": {"type": "string", "const": "0.1.0"},
    "id": {"type": "string", "pattern": "^urn:srcos:agent-machine:capability-declaration:[a-z0-9][a-z0-9-]*$"},
    "kind": {"type": "string", "const": "CapabilityDeclaration"},
    "server": {"type": "string", "pattern": "^[a-z][a-z0-9.-]*$"},
    "tool": {"type": "string", "pattern": "^[a-z][a-z0-9._-]*$"},
    "effect": {"type": "string", "enum": ["read", "write", "compute", "egress", "exec", "decrypt", "admin"]},
    "dangerClass": {"type": "string", "enum": ["LOW", "MEDIUM", "HIGH", "CRITICAL"]},
    "schemaRefs": {
      "type": "object",
      "additionalProperties": false,
      "required": ["input", "output"],
      "properties": {
        "input": {"type": "string"},
        "output": {"type": "string"}
      }
    },
    "constraints": {
      "type": "object",
      "additionalProperties": false,
      "required": ["ttlSecondsMax", "ratePerMinuteMax", "bytesMax", "pathAllowRefs", "domainAllowRefs", "requiresQuorum"],
      "properties": {
        "ttlSecondsMax": {"type": "integer", "minimum": 1},
        "ratePerMinuteMax": {"type": "integer", "minimum": 0},
        "bytesMax": {"type": "integer", "minimum": 0},
        "pathAllowRefs": {"type": "array", "items": {"type": "string"}, "uniqueItems": true},
        "domainAllowRefs": {"type": "array", "items": {"type": "string"}, "uniqueItems": true},
        "requiresQuorum": {"type": "boolean"}
      }
    },
    "dataClasses": {"type": "array", "minItems": 1, "items": {"type": "string", "enum": ["PUBLIC", "INTERNAL", "SENSITIVE", "SECRETS", "CHAIN_OF_CUSTODY"]}, "uniqueItems": true},
    "policy": {
      "type": "object",
      "additionalProperties": false,
      "required": ["policyHookRef", "defaultDecision"],
      "properties": {
        "policyHookRef": {"type": "string"},
        "defaultDecision": {"type": "string", "enum": ["deny", "allow-for-dry-run-only"]}
      }
    },
    "receiptSafety": {"$ref": "#/$defs/receiptSafety"},
    "issuedAt": {"type": "string"},
    "labels": {"type": "object", "additionalProperties": {"type": "string"}}
  },
  "$defs": {
    "receiptSafety": {
      "type": "object",
      "additionalProperties": false,
      "required": ["includeRawContent", "secretValuesIncluded", "privateMemoryIncluded"],
      "properties": {
        "includeRawContent": {"type": "boolean", "const": false},
        "secretValuesIncluded": {"type": "boolean", "const": false},
        "privateMemoryIncluded": {"type": "boolean", "const": false}
      }
    }
  }
}
